id,title,note,excerpt,url,folder,tags,created,cover,highlights,favorite
1470866182,Udemy,,"Udemy is an online learning and teaching marketplace with over 250,000 courses and 80 million students. Learn programming, marketing, data science and more.",https://www.udemy.com/,learning / online-courses,"learning, roblox, blender, c, cloud",2024-08-30T10:16:47.000Z,https://s.udemycdn.com/meta/default-meta-image-v2.png,,false
1470866185,"The Complete 130-HOUR Prompt Engineering, API and Game Development Bundle",,,https://training.mammothinteractive.com/courses/enrolled/2523957,learning / online-courses,"learning, game-development, api",2025-04-24T05:55:58.000Z,https://uploads.teachablecdn.com/attachments/AkMtgcWYS0izSIQbd6Bp_Mammoth-Logo-solo.png,,false
1470866181,Mammoth Interactive,,,https://mammoth-interactive.teachable.com/,learning / online-courses,"ai, learning, blender",2025-04-24T06:05:23.000Z,https://uploads.teachablecdn.com/attachments/AkMtgcWYS0izSIQbd6Bp_Mammoth-Logo-solo.png,,false
1470866183,GameDev.tv,,"We've helped 2 Million+ students learn game development, with courses in Unreal, Unity, Godot, Blender and more, we've got you covered no matter what you want to learn. Start your game dev journey today!",https://www.gamedev.tv/,learning / online-courses,"learning, blender, development",2024-08-30T10:14:33.000Z,https://strapi.gamedev.tv/uploads/Ogre_character_Get_Good_lower_res_8f55348143.jpg,"Highlight:Get Good at Game Dev — Everything you need to build your dream game. 300K 5-Star Reviews, 2M Students, 11 Years of work.",false
1470866184,edX,,Online learning Massive Open Online Course Platform offering courses from leading institutions worldwide,https://www.edx.org/,learning / online-courses,learning,2024-08-30T10:16:22.000Z,,,false
1470866262,Sand Garden - Polar Coordinates,,"Limited Time Offer: Get a Stand-Alone Hack Pack Robot!(No subscription required)Designed for teens and adultsNo subscription requiredComes with everything you needLearn to code with our Coding Console (IDE)!Draw any pattern that you can imagine! Change the parameters, hack the code, and create your very own Sand Garden designs. This robot that uses math and algorithms to draw complex patterns and comes with 10 patterns pre-loaded in the circular bed of sand. Use helper functions in the code to make custom designs of your own.CURRENTLY AVAILABLE IN U.S. ONLY",https://www.crunchlabs.com/products/sandy,learning / hack-pack-kits,"circuits, crunchlabs, kits",2024-11-07T05:13:41.000Z,https://www.crunchlabs.com/cdn/shop/files/ConvertOut-Resized-Reeder_250925_00267-3-2-rectangle_1620x.jpg?v=1764089387,"Highlight:Draw any pattern that you can imagine! Change the parameters, hack the code, and create your very own Sand Garden designs.",false
1470866260,IR Turret - Infrared Communication,,"Limited Time Offer: Get a Stand-Alone Hack Pack Robot!(No subscription required)Designed for teens and adultsNo subscription requiredComes with everything you needLearn to code with our Coding Console (IDE)!With IR Turret, the sky's the limit: go rogue hacking it to use other remote controls around your house or even adding other sensors. Prank mode activated! Play a game of roulette and explore infrared communication to rotate, aim, and execute commands to launch foam darts with precision.CURRENTLY AVAILABLE IN U.S. ONLY",https://www.crunchlabs.com/products/ir-turret,learning / hack-pack-kits,"circuits, crunchlabs, kits",2024-11-07T05:18:36.000Z,https://www.crunchlabs.com/cdn/shop/files/ConvertOut-Resized-Reeder_250925_00240-3-2-rectangle_1620x.jpg?v=1764188058,"Highlight:With IR Turret, the sky's the limit: Go rogue hacking it to use other remote controls around your house or even adding other sensors. Prank mode activated!",false
1470866261,Domino Robot - H-Bridges,,"Hack Pack: Domino Robot! Subscribe now to start building, coding and hacking your very own robots (alongside Mark Rober).",https://www.crunchlabs.com/products/domino-robot,learning / hack-pack-kits,"circuits, crunchlabs, kits",2024-11-07T05:19:00.000Z,https://www.crunchlabs.com/cdn/shop/files/02_DOMNO_1_800x.png?v=1718298619,,false
1745723140,Asurion,,"Asurion is a leading provider of device protection and support services for smartphones, consumer electronics and home appliances. Protect your device now.",https://www.asurion.com/,personal,insurance,2026-06-05T11:31:12.514Z,https://images.ctfassets.net/16nm6vz43ids/7r7xMTdAqKFOwtchMdvPj2/a50d1093ce5bb0ca17b2563931927cb6/general-SEO_1200x630-logo.png,,false
1745720742,Adobe,,"Adobe is changing the world through digital experiences. We help our customers create, deliver and optimize content and applications.",https://adobe.com,personal,"subscription, creative, cloud",2026-06-05T11:27:28.779Z,https://www.adobe.com/homepage/assets/product-icons/jpg/default.jpg?width=1200&format=pjpg&optimize=medium,,false
1747628883,"Domainnamen, Websites, Hosting und Tools für das Online-Marketing – GoDaddy DE",,"Alle Hilfe und Tools für den Ausbau der Präsenz im Internet: Websites, Domains, digitales Marketing und Marketing in den sozialen Netzwerken – und dazu GoDaddy Anleitungen für jeden Schritt.",https://www.godaddy.com,personal / recreation,hosting,2026-06-06T19:16:50.260Z,https://img1.wsimg.com/cdnassets/transform/72b2081c-ee0f-4646-ad2a-6e690a4f8056/og-godaddy,,false
1744263634,Firewalla,,,https://firewalla.net,personal / recreation,"firewall, network",2026-06-04T00:16:40.078Z,,,false
1470866205,LEGO,,"Explore the world of LEGO® through games, videos, products and more! Shop awesome LEGO® building toys and brick sets and find the perfect gift for your kid",https://www.lego.com/,personal / recreation,"lego, shopping",2024-11-06T06:17:15.000Z,,,false
1470833805,Google Play Books,,"Choose from millions of best-selling ebooks, audiobooks, comics, manga, and textbooks. Save books in your library and then read or listen on any device, including your web browser.",https://play.google.com/books/s/709834274181,personal / recreation,"library, reading, genealogy",2025-12-03T18:12:58.259Z,,,false
1470840819,Ubisoft,,"Achetez sur la boutique officielle d'Ubisoft, plongez dans notre vaste catalogue de jeux, DLC et offres exclusives maintenant. Découvrez Ubisoft+",https://store.ubisoft.com/,personal / recreation,"gaming, shopping",2025-12-03T18:23:39.453Z,,,false
1470866149,Busch Gardens Williamsburg,,test page,https://buschgardens.com/williamsburg/annual-pass/monthly-offers,personal / recreation,"membership, themepark",2019-09-13T13:31:26.000Z,,,false
1470866111,Geocaching - The Official Global GPS Cache Hunt Site,,"There are millions of geocaches worldwide, just waiting for you to find them. There are probably even some within walking distance of where you are right now. Visit Geocaching.com to see just how many geocaches are nearby and to learn how to start finding them.",http://www.geocaching.com/,personal / recreation,"geocaching, health",2013-04-28T14:44:24.000Z,https://www.geocaching.com/play/Content/images/preview-lg.jpg,,false
1611621782,Quicken Classic - Welcome,,Welcome to Quicken personal finance,https://app.quicken.com/,personal / financial,"banking, financial-services, software",2026-02-21T22:30:09.530Z,,,false
1608599087,Dovemuehle,,,https://yourmortgageonline.com/payments,personal / financial,"financial-services, legal",2026-02-19T18:53:30.390Z,,,false
1470866240,Westlake Financial,,Pre-qualify for an auto loan and browse vehicles based on your approval without impacting your credit. Existing customers can also manage their account.,https://www.westlakefinancial.com/,personal / financial,"financial-services, auto-loan",2024-12-20T04:46:02.000Z,https://westlakefinancialdev.blob.core.windows.net/media/2019/12/auto-loan-calculator-cars.jpg,,false
1470866242,PNC Bank,,"PNC Bank offers a wide range of personal banking services including checking and savings accounts, credit cards, mortgage loans, auto loans and much more.",https://www.pnc.com/en/personal-banking.html,personal / financial,"banking, financial-services",2025-04-09T18:44:19.000Z,https://www.pnc.com/etc.clientlibs/pnc-aem-base/clientlibs/clientlib-site/resources/icon-310x310.png,,false
1470866243,PayPal,,Transfer money online in seconds with PayPal money transfer. All you need is an email address.,https://www.paypal.com/us/signin,personal / financial,digital-wallet,2019-03-20T18:33:19.000Z,https://www.paypalobjects.com/webstatic/icon/pp258.png,,false
1470866250,HRSD/HRUBS,,,https://www.invoicecloud.com/hrsd-hrubs,personal / financial,utility,2023-08-27T21:14:01.000Z,,,false
1470866244,GM Financial,,,https://beta.gmfinancial.com/en-us/myaccount/login.html,personal / financial,"financial-services, auto-loan",2019-03-20T18:30:53.000Z,,,false
1470866247,Dominion Energy,,You are on Dominion Energy HomePage.,https://www.dominionenergy.com/,personal / financial,utility,2024-12-30T16:05:28.000Z,,,false
1470866248,Cash App,,"Download Cash App to send & receive money instantly, spend with the Cash App Card, buy bitcoin, invest in stocks, & manage your finances.",https://cash.app/,personal / financial,"taxes, digital-wallet, financial-services",2025-02-03T08:09:30.000Z,https://images.ctfassets.net/jwea2w833xe7/2maRcQIGFZk9n95SSDj9eM/77ec453e4b5f1d3319cf920006002d65/share_home.png,,false
1470838678,Capital One,,"Capital One Financial Corporation is an American financial services company that specializes in credit cards, banking products like checkings and savings accounts, auto loans and business solutions.",https://www.capitalone.com/,personal / financial,"auto-loan, credit-cards, financial-services",2025-12-03T18:21:22.330Z,https://ecm.capitalone.com/WCM/homepage/photos/seo/capitalone-homepage.jpg,,false
1470838529,Credit Karma,,"Personalized recommendations, tools and insights to help you understand your credit scores and power your financial progress.",https://www.creditkarma.com/,personal / financial,credit-cards,2025-12-03T18:21:04.818Z,https://ck-content.imgix.net/res/content/bundles/homepage/3.1.2/assets/open_graph_2.png,,false
1747628706,Bitdefender Central,,"Bitdefender Central is your control panel for subscription management, product installation, device security monitoring, and 24/7 support.",https://central.bitdefender.com,tech-foundry-360,"subscription, cyber-security, software, acs",2026-06-06T19:16:24.636Z,,,false
1557716337,Xume,,,https://xume.net,tech-foundry-360,"hosting, subscription",2026-01-23T10:27:38.475Z,,,false
1557715966,Zoho,,"Eine einzigartige und leistungsstarke Software-Suite, die Ihre Arbeitsweise verändert. Entwickelt für Unternehmen jeder Größe; von einem Unternehmen gebaut, das Ihre Privatsphäre schätzt.",https://www.zoho.com,tech-foundry-360,"subscription, cloud",2026-01-23T10:26:49.199Z,https://www.zohowebstatic.com/sites/zweb/images/ogimage/zoho-logo.png,,false
1470866211,Microsoft 365,,"Collaborate for free with online versions of Microsoft Word, PowerPoint, Excel, and OneNote. Save documents, workbooks, and presentations online, in OneDrive. Share them with others and work together at the same time.",https://www.microsoft365.com/,tech-foundry-360,"microsoft, cloud",2023-08-27T21:03:19.000Z,,,false
1470866216,TechFoundry 360,,,https://www.techfoundry360.com/,tech-foundry-360,learning,2025-09-05T19:59:14.000Z,https://images.squarespace-cdn.com/content/v1/68b1e38eb2a13a48c35d8062/c4805e90-b6e9-40a0-87e1-eae4dba10a8c/logo-removebg-preview.png,,false
1470832832,Microsoft Partner Center,,,https://partner.microsoft.com/en-us/dashboard/home,tech-foundry-360,microsoft,2025-12-03T18:11:09.128Z,,,false
1470853537,Cool Math Games - Free Online Games for Learning and Fun,,"Coolmath Games is a brain-training site for everyone, where logic & thinking & math meets fun & games. These games have no violence, no empty action, just a lot of challenges that will make you forget you're getting a mental workout!",https://www.coolmathgames.com/,gaming,learning,2025-12-03T18:30:04.556Z,https://www.coolmathgames.com/themes/custom/coolmath/assets/images/CMG_OG_image.png,,false
1470839867,Abandonware,,,http://free-game-downloads.mosw.com/,gaming,"gaming, retro",2025-12-03T18:22:39.391Z,,,false
1470866208,CLZ,,Log in with your CLZ Account,https://my.clz.com/,gaming,"subscription, library, movies",2024-11-25T07:33:17.000Z,,,false
1470844249,SteamGridDB,,Download and share custom video game assets and personalize your gaming library.,https://www.steamgriddb.com/,gaming,"library, gaming",2025-12-03T18:26:40.758Z,https://www.steamgriddb.com/static/img/logo-512.png,,false
1470841178,Steam Store,,"Steam is the ultimate destination for playing, discussing, and creating games.",https://store.steampowered.com/,gaming,"shopping, gaming",2025-12-03T18:24:10.249Z,https://cdn.fastly.steamstatic.com/store/home/store_home_share.jpg,,false
1470843754,Retrogames,,,http://www.retrogames.com/,gaming,gaming,2025-12-03T18:26:12.501Z,,,false
1470843145,Nintendo,,,https://www.nintendo.com/,gaming,"console, gaming",2025-12-03T18:25:17.898Z,https://www.nintendo.com/eu/app/media/images/10_share_images/others_3/SI_GenericNintendo_image1280w.jpg,,false
1470841394,IGN,,,https://www.ign.com/,gaming,"reviews, gaming",2025-12-03T18:24:34.323Z,https://de.ign.com/s/ign/social_logo.png,,false
1470840586,Humble Bundle,,Pay what you want. Support charity. Get awesome games.,https://www.humblebundle.com/,gaming,"shopping, gaming",2025-12-03T18:23:29.638Z,https://cdn.humblebundle.com/static/hashed/8a88fa654693019cbe2ea724259402d591fd26e6.jpg,,false
1470850056,Fandom,,"The entertainment site where fans come first. Your daily source for all things TV, movies, and games, including Star Wars, Fallout, Marvel, DC and more.",https://www.fandom.com/,gaming,"gaming, social",2025-12-03T18:29:20.171Z,https://static.wikia.nocookie.net/750feb85-de88-4a4f-b294-8b48142ac182/thumbnail-down/width/1280/height/720,,false
1470840358,Fanatical,,"Get massive savings on exclusive Steam bundles and great PC, Mac, and Linux games - updated daily. Join our community of over 2.6 million gamers -...",https://www.fanatical.com/,gaming,"shopping, gaming",2025-12-03T18:23:12.001Z,https://cdn-ext.fanatical.com/production/assets/fan-og-default.jpg,,false
1470866254,Discord,,"Discord is great for playing games and chilling with friends, or even building a worldwide community. Customize your own space to talk, play, and hang out.",https://discord.com/,gaming,social,2024-11-07T05:12:36.000Z,https://cdn.prod.website-files.com/6257adef93867e50d84d30e2/665643dd8c7ac752237b5cef_Discord-OG-1200x630.jpg,,false
1470858220,"The Roottrees are Dead - How to Lock Clancy, Lauren and Gwynn",,,"https://www.neoseeker.com/the-roottrees-are-dead/Clancy_Edward,_Lauren_and_Gwynn#Notable_Roottrees",gaming / tips-tricks-walkthroughs,"trees, gaming",2025-12-03T18:31:18.197Z,https://cdn.staticneo.com/ew/thumb/3/30/Roottrees_ClancyEdward-Lauren-Gwynn.jpg/730px-Roottrees_ClancyEdward-Lauren-Gwynn.jpg,,false
1470859188,Characters in The Roottrees are Dead,,,https://tvtropes.org/pmwiki/pmwiki.php/Characters/TheRoottreesAreDead,gaming / tips-tricks-walkthroughs,"trees, gaming",2025-12-03T18:31:25.777Z,https://static.tvtropes.org/pmwiki/pub/images/gwyneth_roottree_6.png,,false
1470866133,Energy Fiend Â» Death by Caffeine,,"Caffeine dangers, benefits, and safety.  Find the caffeine amounts in energy drinks, coffee, tea, soda, and food with our extensive interactive database.",http://www.energyfiend.com/death-by-caffeine,interesting,caffeine-calculator,2013-04-28T14:44:24.000Z,,,false
1470866129,HowStuffWorks - Learn how Everything Works!,,"HowStuffWorks has been explaining how things work to curious minds since 1998. Providing factual, unbiased content that's fun to read and makes difficult topics easy to understand.",http://www.howstuffworks.com/,interesting,engineering,2013-04-28T14:44:24.000Z,https://cdn.hswstatic.com/gif/hsw-logo-120x90.jpg,,false
1470866114,Caffeine Calculator,,This caffeine calculator shows how much of a caffeinated drink is safe and how much could be deadly based on a person's body weight.,https://www.caffeineinformer.com/death-by-caffeine,interesting,"caffeine-calculator, health",2023-11-22T15:38:07.000Z,,"Highlight:Caffeine can be lethal with a high enough dosage, and you can get very sick from over-consuming caffeine. People have died from over-consuming caffeine.
Sticky notes:Good to know the risks!",false
1745721837,Aidvantage,,,https://aidvantage.studentaid.gov/,school,"education, financial-services",2026-06-05T11:28:43.515Z,,,false
1470836219,LUOA Shop,,,https://shopluoa.com/luoa/shop/home,school,"shopping, learning",2025-12-03T18:16:48.700Z,https://cdn.inksoft.com/images/publishers/14895/stores/luoa/img/socialmedia.png,,false
1470835529,Bambu Labs Store,,"Bambu Lab P1S is an affordable, reliable fully enclosed 3D printer with fans and carbon filters, ideal for advanced filaments and odor-free FDM 3D printing.",https://us.store.bambulab.com/products/p1s,shopping,"shopping, 3d-printing",2025-12-03T18:15:31.063Z,https://store.bblcdn.com/s7/default/eb7a556bcdde4897b5ba19ad007a7335/P1S.jpg,,false
1612373007,EasyEDA - Online PCB design & circuit simulator,,"EasyEDA is a free and easy to use circuit design, circuit simulator and pcb design that runs in your web browser.",https://easyeda.com/,tools-and-troubleshooting,"circuits, cloud, stem",2026-02-22T16:50:04.859Z,https://easyeda.com/images/index-banner.jpeg?id=69d9035b735ad0137390,,false
1612372053,PCB Prototype & PCB Fabrication Manufacturer - JLCPCB,,"Industry-Leading PCB Prototype Manufacturer | 24-Hour Quick-Turn Prototypes, PCB Assembly, and Low-Volume Production. Get Instant Quote & DFM Support!",https://jlcpcb.com/,tools-and-troubleshooting,"circuits, stem",2026-02-22T16:48:13.536Z,https://jlcpcb.com/logo-og.png,,false
1470866209,My No-IP,,Sign In to your No-IP Account now to start managing your No-IP account,https://my.noip.com/,tools-and-troubleshooting,"subscription, dynamic-dns",2025-02-03T08:08:53.000Z,,,false
1470866305,Microsoft Remote Connectivity Analyzer,,,https://testconnectivity.microsoft.com/,tools-and-troubleshooting,"analyzer, diagnostics, exchange",2019-09-06T16:05:12.000Z,,,false
1745722881,American Airlines,,,https://aa.com,travel,"travel, airline",2026-06-05T11:30:13.964Z,,,false
1470866171,National Car Rental,,"Join Emerald Club and enjoy exclusive benefits including counter bypass, choose your own car and earn rewards towards free rental days (select locations).",https://www.nationalcar.com/en/home.html,travel,travel,2024-07-09T14:57:10.000Z,,,false
1470866170,Carnival Cruise Line,,"Carnival cruise deals and cruise packages to the most popular destinations. Find great deals and specials on Caribbean, The Bahamas, Alaska, and Mexico cruises.",https://carnival.com/,travel,"travel, cruise",2023-08-27T21:23:10.000Z,,,false
1470866169,Hilton Hotels,,"Explore Hilton's portfolio of hotels and distinct brands across the globe. Book directly for the best rates during your next stay. Expect better, expect Hilton",https://www.hilton.com/en,travel,"hotels, travel",2023-09-19T06:50:29.000Z,https://www.hilton.com/im/en/NoHotel/25182770/25-5432-ent-nov-sale-ohw-carousel.jpg?impolicy=crop&cw=4096&ch=1755&gravity=NorthWest&xposition=0&yposition=274&rw=1920&rh=823,,false
1470835839,KOA,,Spend your next short term camping or long term camping trip at a KOA campground! Make a reservation at one of our 500+ campgrounds in North America today!,https://koa.com/,travel,"campground, travel",2025-12-03T18:16:11.777Z,,,false
